1d20	POI-沼泽
1	一位见习女巫在骑行 A Prentice Witch-a-Riding
2	泥浆泉 Mud Springs
3	古木林带 The Old Growth Strand
4	棺材树 The Coffin Tree
5	鬼火 Ignis Fatuus
6	羽翼联邦 The Feathered Federation
7	苔藓采集者 The Moss Gatherers
8	焦背蜥蜴人 Tarback Lizardfolk
9	沃拉赫塔 The Volachta
10	山洪暴发 Flash Flood
11	腐烂地带 The Rotting Strip
12	巨大的木材堵塞 The Tremendous Timber Jam
13	国王仪仗队 The Cortege Of Kings
14	沉没的神殿 The Sinking Shrine
15	迷失的牧人 The Lost Drovers
16	建造者遗迹 The Builders
17	黑安妮斯 The Black Annis
18	他那长须威严的陛下 His Bebarbeled Majesty
19	马尔德拉基斯 Maldraakis
20	吸血生物 Bloodsuckers
