1d100	提夫林特征
1	能够脱臼下巴，吞下令人惊讶的大物件（如柚子大小） Able to unhinge your Jaw and swallow surprisingly large things (Grapefruit-sized)
2	手掌和脚底附着的脊状结构使你比大多数人更擅长攀爬 Adhering Ridges on Palms and Feet make you a better Climber than most
3	接近九度音域的嗓音范围：刺耳的滑音与胸腔震颤的低音 Almost 9 Octaves of Vocal Range: piercing swoops & chest rattling thrums
4	另一副水平移动的眼睑，使得眨眼显得异常怪异 Another set of Eyelids that Travels Horizontally makes for strange Winks
5	鹿角永远覆盖着血色的茸毛，可无痛锯下，且能再生 Antlers perpetually draped in bloody velvet, can be painlessly sawed, grow back
6	腋下藏有嘴巴，用于半隐秘的说话或进食，睡觉时低语 Armpits conceal Mouths for semi-surreptitious Speech/Eating, murmur in Sleep
7	理发师的克星：头发无法被剪断，但你可以随意将其脱落至所需长度 Barber's Bane: Hair cannot be Cut, but you can shed it to length at-will
8	眼下有生物发光斑块（自选颜色），可抑制（发出5英尺范围的光） Bioluminescent Patches below eyes (choose color), can suppress (5ft of light)
9	肘部生有刀刃般的骨头，伤害如匕首，可半收放 Blade-like Bones from Elbows, damage as a Dagger, semi-retractable
10	颈部生有珊瑚状分支鳃：在潮湿环境中无需饮水 Branching, Coral-like Gills on Neck: No need to drink in Humid Environments
11	亮粉色蠕动的蠕虫诱饵舌头：对鱼类和鸟类具有无法抗拒的吸引力 Bright pink, wriggling worm-lure Tongue: Irresistible to Fish and Birds
12	宽阔的前额覆盖着装甲，点缀着四只小角 Broad, Armor-plated Forehead graced with four small Horns
13	长着一个圆肿的鼻子，能以2/6的几率嗅出附魔效果 Bulbous, swollen Nose that can smell Enchantment on a 2-in-6
14	通过短暂集中注意力，你可以使手中持有的水果迅速腐烂。 By briefly concentrating, you can cause Fruit held in your hand to Spoil
15	能够用泡沫状唾液覆盖全身：隔绝极端温度 Can cover yourself in Foamy Spittle: Insulates from Temperature Extremes
16	"无法出汗，但可以通过眼睛“喘气”，令人不安 Cannot Perspire, but you can ""Pant"" through your Eyes disconcertingly"
17	鲶鱼般的触须，敏感，在隐秘施法时会抽动 Catfish-like Barbles, sensitive, twitch around surreptitious Spellcasting
18	选择其一：老鼠、蝎子、蜘蛛、叮咬的飞虫：永远不会骚扰你 Choose one: Rats, Scorpions, Spiders, Biting Flies: Never pester you
19	可用手套遮掩，但一只手明显为骷髅形态 Concealable with a Glove, one hand is unmistakably Skeletal
20	螺旋状的角，非常适合用来开瓶 Corkscrew Horns that are perfectly serviceable for this function
21	全身覆有细毛，头上的触须或许能藏在帽子里 Covered in fine Hair, the Tentacles on your head might be concealable in a Hat
22	你受伤时流出的血液呈青色，带有薄荷的味道。 Cyan-colored Blood sheds from Wounds you receive, tastes of Mint
23	尽管拥有正常的双脚，但你留下的任何足迹都是分趾蹄印。 Despite possessing normal Feet, any tracks you leave are Cloven Hoofprints
24	每只手上第二根手指异常细长，如锥子般长度 Disturbingly long and thin second Finger on each hand, Bodkin length
25	没有肚脐：取而代之的是一只闪烁的绿色眼睛 Do not possess an Belly-Button: in it’s place there's a Blinking Green Eye
26	头顶覆盖着向下或深色羽毛，温暖且防水 Down or Dark Feathers instead of Hair atop your Head, warm and waterproof
27	在月光下呈现出诡异半透明的皮肤与肌肉 Eerily Translucent Skin and Musculature in Moonlight
28	肘部和膝盖能够令人不安地向后弯曲 Elbows and Knees that can bend Backwards disturbingly
29	根据情绪散发强烈气味：愤怒时恶臭，但快乐时芬芳 Exude powerful Scents based on Emotion: Angry is foul, but Happy is nice
30	恶魔或魔鬼周围竖立着羽毛状、蕨类植物般的额前触须 Feathery, frond-like forehead Feelers stand up straight around Demons/Devils
31	猫科动物的胡须，若被拔除或剃掉，几小时内即可重新长出。 Feline whiskers, that regrow in a few hours if plucked or shaved.
32	由于多出一两根手指，寻找合适的手套或护手变得困难 Finding Gloves/Gauntlets that fit is hampered by an extra digit or two
33	每日必须锉平手指甲和脚趾甲，否则它们会变得难以控制。 Finger and Toenails must be filed down Daily, or they get quite out of hand
34	因神秘原因，蜘蛛网无法粘附于你，蛛网自动分开 For mysterious reasons, Spider Webs refuse to stick to you, Cobwebs part
35	分叉且带刺的舌头，灵活到足以解开绳结 Forked and barbed Tongue, agile enough to untie Knots with
36	分形、带凸缘的牙齿使坚果/贝壳/骨头迅速被处理 Fractal, flanged Teeth make Nuts/Shells/Bones quick work
37	背部生出毛茸茸的球状结节，能在水中漂浮 Fuzzy, orb-like Nodules sprout from Back, they float in Water
38	产生轻微电击：足以可能使一只大老鼠晕眩 Generate a Mild Shock: Enough to maybe stun a Large Rat
39	玻璃会起雾，仿佛在你面前受到一股冷空气的冲击 Glass Fogs up, as if buffeted by a Cold Blast of air in your presence
40	间歇性剧烈咳嗽时，会吐出小而友善的蜘蛛 Hacking Cough sometimes produces small but friendly Spiders
41	光头/无毛面容，整齐得令人不安的牙齿：能够消化腐肉 Hairless Head/Face, unsettlingly Even Teeth: Able to Digest Carrion
42	手腕可旋转，有时有助于挣脱束缚 Hands can rotate on Wrists, sometimes assists with escaping Bonds
43	心脏不在胸腔的常规位置，不确定它究竟跑哪儿去了 Heart isn't where it should be in your Chest, not sure where that got off to
44	在你周围20英尺内放置超过一小时的圣水会变成普通的水。 Holy Water that is within 20 feet of you for more than an hour becomes Water
45	如果不经常修剪，下颌的獠牙会影响说话 If you don't keep them filed, the Tusks on your lower Jaw can impact Speech
46	无痛之躯，舌头确信可延伸至二十英尺 Impervious to Pain, pretty sure that Tongue can extend up to twenty feet
47	头部两侧只有两个小孔，而非耳朵 Instead of Ears, there are only two small apertures in the side of your head
48	你的舌头被一种等足类寄生虫取代：它吞食你的食物，并知晓一个法术 Isopod-like Parasite has replaced your Tongue: Eats your food, knows a Spell
49	关节处嵌有小卵形铁块，嵌入皮肤之中 Joints are studded with small ovoid lumps of Iron, embedded in your skin
50	叶状鼻子和超大耳朵辅助进行微弱的回声定位（10-20英尺） Leaf-like Nose and over-sized Ears aid in weak Echolocation (10-20 feet)
51	当你有意说谎时，嘴唇会变色 Lips change Color when you intentionally utter a Falsehood
52	长而半抓握的耳垂，或许能夹住一枚硬币的重量 Long, semi-prehensile Ear Lobes, can maybe grip a Coin's weight
53	臼齿锋利且强韧，足以切断绳索，咬出钢痕 Molars sharp and strong enough to cut through Rope, dent Steel
54	自然流动的水（河流/溪流）会像酸液一样灼伤你，最好避开它 Naturally running Water (Rivers/Streams) scalds you like Acid, best to avoid it
55	你的头骨眼窝中没有眼睛，但你能正常视物 No Eyes in the sockets of your Skull, but you can see as normal
56	鼻子主要用于装饰：通过手掌上令人密集恐惧的孔洞进行嗅觉/呼吸 Nose is largely for show: Smell/Breathe through Trypophobic holes in Hands
57	结节状棘刺，从下颌开始，沿身体两侧延伸 Nub-like Spines, start at lower Jaw and continue down your Sides
58	一只手比另一只大（尺寸加倍），且长有锋利的爪子 One Hand is larger than the other (doubled in size) and wickedly clawed
59	咽颌，可在稍远处咬住物体 Pharyngeal Jaw, should you need to bite something just a bit further away
60	肩部带有板状护肩，需定制护甲，防护效果等同于皮甲 Plate-like Pauldrons on Shoulders, require Custom Armor, protect as Leather
61	拥有内置的隐藏袋，可容纳最多50枚硬币，通常难以察觉 Possess an integrated Pouch, can hold up to 50 coins and is usually Undetectable
62	存在使牛奶凝结，专注十分钟可令奶酪变质 Presence curdles Milk, can spoil Cheese with 10 minutes of concentration
63	瞳孔呈宽大的深色矩形，令人不安的凝视 Pupils are wide, dark rectangles, making for disconcerting Stares
64	肋骨处颤动的深红色外鳃：可在水下停留最多3轮 Quivering Crimson External Gills along Ribcage: Stay Under for up to 3 Turns
65	拥有粗糙、齿舌般的舌头，能够磨利刀刃，舔去金箔 Raspy, Radula-like Tongue that can sharpen Blades, Lick off Gold Leaf
66	在一个月内再生失去的脚趾、手指或鼻子 Regenerate a lost Toe, Finger, or Nose over the course of a month
67	背部长有一排鬃毛，遇到龙类时往往会竖立起来 Ridge of Bristles down your back, tends to stand up around Dragons
68	牙齿排列如鲨鱼嘴：进食时偶尔会脱落 Rows of Teeth, like a Shark's Mouth: they occasionally fall out when eating
69	松垮下垂的腹部使你能够连续两天不进食而毫无影响 Saggy, extended Gut allows you to forego up to 2 days of food with no effect
70	唾液呈现出不寻常的酒红色，若你愿意，可以生成满满一杯 Saliva is an unusual wine-colored tint, if you choose, you can generate a Goblet full
71	巩膜呈现单一且明显不寻常的颜色 Sclera is a solid Color, and a noticeably unusual one at that
72	分泌一种粘稠、甜香的树液状汗液：很少掉落物品 Secrete a sticky, sweet-smelling sap-like Sweat: Dropping things is rare
73	鳞片分节，有时可见皮肤蜕落或剥落 Segmented Scales, visible sometimes as Skin Molts or Sloughs off
74	紧咬之颚与紧握：若你选择，它将至死方休 Seizing Jaw and Grip: If you choose, it won't disengage until Death
75	尖锐的骨骼可以从指尖或脚趾痛苦地刺出：如同匕首 Sharp Bones can be made to painfully erupt from Fingertips/Toes: As Dagger
76	皮肤色素根据上次进食时间在三种色调间变化 Skin Pigmentation shifts between three shades, based on when you last ate
77	眼下有小凹坑，分叉的舌头能感知附近的热源 Small pits beneath Eyes and a forked Tongue that senses nearby Heat
78	每次打喷嚏都会伴随一把海盐的喷出 Sneezes are accompanied by a handful's worth of Sea Salt, every time
79	你的脚底对高温免疫（直至岩浆温度） Soles of your Feet are impervious to Heat (up to Magma)
80	从鼻尖开始，一排小角沿着你的背部中线延伸 Starting on Tip of Nose, a Ridge of small Horns bisects you down your Back
81	腿上的摩擦刺毛在相互摩擦时会发出尖锐的哀鸣声 Stridulating Quills on Legs make a Keening sound when rubbed together
82	长时间暴露在阳光下会导致灼伤：需裹紧衣物 Sunlight sensitivity results in scalding after prolonged periods: Bundle up
83	你触碰的表面会在几分钟后逐渐染上浓郁的赭石色。 Surfaces you Touch gradually stain a rich, Umber Color after a few Minutes
84	能够吞下并吐出小型物品（价值不超过10铜币）且无损伤 Swallow and Regurgitate Small Items (up to 10 cns worth) with no harm
85	尾巴，苍白无毛如负鼠，握力极其微弱 Tail, pale and hairless like an Opossum, possesses a very weak grip
86	手臂/腿部韧带紧绷，投掷距离/跳跃距离增加10英尺 Taut Ligaments in Arms/Legs, increases Throw Range/Leap Distance 10'
87	你投下的影子是一个布满尖刺的怪物形态 The Shadow you cast is a monstrous, spine-studded thing
88	"薄薄的皮肤下隐藏着一只“第三只眼”，能感知光线的变化 Thin layer of Skin conceals a ""Third Eye"" that senses changes in Light"
89	指尖或趾尖生有微小的钳状结构：极适合精细工作 Tiny, Pincher-like Tips grace your Fingers/Toes: Excellent for delicate work
90	脚趾和手指呈半透明蹼状，擅长游泳 Toes and Fingers are translucently Webbed, good Swimmer
91	表层皮肤可剥离，或许价值如羊皮纸：便捷的绷带 Top Layer of Skin can be Peeled, maybe Foolscap worth: Handy Bandages
92	额头上的两处斑点在愤怒时会闪烁出邪恶的橙色火焰 Two spots on Forehead glow with a baleful, flickering orange fire when angry
93	无法通过门上挂有马蹄铁的门进入 Unable to enter through a Door bearing a Horseshoe above it
94	非凡的下颚力量，能够紧咬并支撑你的体重外加另一个人的重量 Uncanny Jaw strength, can clamp down and support your weight + another
95	每月经历一次痛苦的蜕皮：消除疤痕，去除衰老痕迹 Undergo a Painful Molt every Month: Removes Scars, Signs of Age
96	独特的发冠，由细长且中空的刺组成，颜色可自选 Unusual Coif of narrow and hollow Quills in the color of your Choice
97	鲜艳色彩的喉囊/垂肉：令小型哺乳动物感到恐惧 Vibrantly colored throat-pouch/dewlap: Causes fear in Small Mammals
98	每天可呕吐出相当于一小瓶量的优质墨水，颜色可自选 Vomit forth a Vials worth of Good Quality Ink a Day in Color of your choice
99	只要有足够的助跑，你便能跑过一箭之遥的水面 With at least the same running start, you can run across a bowshot of Water
100	你的眼睛能无害地喷出少量血液（相当于一次痛哭的量） Your Eyes can harmlessly squirt a small volume of Blood (a good cry's worth)
